{
  "generated_on": "2026-09-09T08:32:49.587653+00:00",
  "sources": [
    "kaggle-datasets",
    "huggingface-datasets",
    "huggingface-models",
    "huggingface-spaces",
    "github-repositories",
    "gitlab-projects",
    "openalex",
    "crossref",
    "zenodo",
    "dataverse",
    "datacite",
    "arxiv",
    "semantic-scholar"
  ],
  "candidate_count": 28,
  "candidates": [
    {
      "id": "candidate-datacite-dataset-album-6-the-final-trumpet-sounds-multilingual-christian-worship-pashto-bengali-u",
      "title": "Album 6 - The Final Trumpet Sounds  (Multilingual Christian Worship) - Pashto, Bengali, Urdu, Nepali, and Sinhala",
      "url": "https://zenodo.org/doi/10.5281/zenodo.21259510",
      "category": "dataset",
      "source": "datacite",
      "status": "candidate",
      "summary": "Album 6 – The Final Trumpet Sounds. 6 Tamil Christian worship songs translated into 5 languages: Pashto, Bengali, Urdu, Nepali, and Sinhala. Full package includes high-quality MP3 files and lyrics PDFs for each language. List of Songs Benga",
      "primary_use": "Needs maintainer review before promotion to verified catalog.",
      "tasks": [],
      "pashto_evidence": {
        "evidence_text": "DataCite metadata includes Pashto markers in title or description.",
        "evidence_url": "https://zenodo.org/doi/10.5281/zenodo.21259510",
        "markers": [
          "pashto"
        ]
      },
      "tags": [
        "pashto",
        "candidate",
        "dataset",
        "datacite"
      ]
    },
    {
      "id": "candidate-crossref-figure-2-pashto-document-images-containing-pashto-text-and-graphics",
      "title": "Figure 2: Pashto document images containing pashto text and graphics.",
      "url": "https://doi.org/10.7717/peerj-cs.2089/fig-2",
      "category": "paper",
      "source": "crossref",
      "status": "candidate",
      "summary": "Candidate paper returned from Crossref search for Pashto.",
      "primary_use": "Needs maintainer review before promotion to verified catalog.",
      "tasks": [],
      "pashto_evidence": {
        "evidence_text": "Matched by explicit Pashto marker in title from Crossref search.",
        "evidence_url": "https://doi.org/10.7717/peerj-cs.2089/fig-2",
        "markers": [
          "pashto"
        ]
      },
      "tags": [
        "pashto",
        "candidate",
        "paper",
        "crossref"
      ]
    },
    {
      "id": "candidate-datacite-paper-heremites-afghanicus-jablonski-hofmann-idrees-khan-jamal-b-hme-masroor-2026-sp-n",
      "title": "Heremites afghanicus Jablonski, Hofmann, Idrees, Khan, Jamal, Böhme & Masroor, 2026, sp. nov.",
      "url": "https://zenodo.org/doi/10.5281/zenodo.22309209",
      "category": "paper",
      "source": "datacite",
      "status": "candidate",
      "summary": "Heremites afghanicus sp. nov. Figs 4, 5 Suggested vernacular names. English name: Afghan grass skink or Dir grass skink. Pashto name: د افغانستان واښه څرمښکۍ یا دیر واښه څرمښکۍ (Da Afghanistan Wakha Sarmakhkay, Dir Wakha Sarmakhkay). Urdu n",
      "primary_use": "Needs maintainer review before promotion to verified catalog.",
      "tasks": [],
      "pashto_evidence": {
        "evidence_text": "DataCite metadata includes Pashto markers in title or description.",
        "evidence_url": "https://zenodo.org/doi/10.5281/zenodo.22309209",
        "markers": [
          "pashto"
        ]
      },
      "tags": [
        "pashto",
        "candidate",
        "paper",
        "datacite"
      ]
    },
    {
      "id": "candidate-gh-project-homayounmmdy-afn-currency-text",
      "title": "homayounmmdy/afn-currency-text",
      "url": "https://github.com/homayounmmdy/afn-currency-text",
      "category": "project",
      "source": "github",
      "status": "candidate",
      "summary": "Convert numbers to legal Afghan Afghani (AFN) wording in Dari and Pashto. Perfect for invoices, banking, and official documents.",
      "primary_use": "Needs maintainer review before promotion to verified catalog.",
      "tasks": [],
      "pashto_evidence": {
        "evidence_text": "Repository metadata (name/description/topics) includes Pashto markers.",
        "evidence_url": "https://github.com/homayounmmdy/afn-currency-text",
        "markers": [
          "pashto"
        ]
      },
      "tags": [
        "pashto",
        "candidate",
        "project",
        "github",
        "afghan",
        "afghanistan",
        "banking"
      ]
    },
    {
      "id": "candidate-gh-project-iaqeelasghar-pakhtoodle",
      "title": "Iaqeelasghar/pakhtoodle",
      "url": "https://github.com/Iaqeelasghar/pakhtoodle",
      "category": "project",
      "source": "github",
      "status": "candidate",
      "summary": "Candidate Pashto-related GitHub repository.",
      "primary_use": "Needs maintainer review before promotion to verified catalog.",
      "tasks": [],
      "pashto_evidence": {
        "evidence_text": "Repository metadata (name/description/topics) includes Pashto markers.",
        "evidence_url": "https://github.com/Iaqeelasghar/pakhtoodle",
        "markers": [
          "pashto"
        ]
      },
      "tags": [
        "pashto",
        "candidate",
        "project",
        "github"
      ]
    },
    {
      "id": "candidate-gh-code-jawadnoori1718-pashtobench",
      "title": "Jawadnoori1718/PashtoBench",
      "url": "https://github.com/Jawadnoori1718/PashtoBench",
      "category": "code",
      "source": "github",
      "status": "candidate",
      "summary": "How well do frontier AI models actually speak Pashto? A native-authored capability and safety benchmark for a language of 40+ million people.",
      "primary_use": "Needs maintainer review before promotion to verified catalog.",
      "tasks": [],
      "pashto_evidence": {
        "evidence_text": "Repository metadata (name/description/topics) includes Pashto markers.",
        "evidence_url": "https://github.com/Jawadnoori1718/PashtoBench",
        "markers": [
          "pashto"
        ]
      },
      "tags": [
        "pashto",
        "candidate",
        "code",
        "github",
        "ai-safety",
        "benchmark",
        "llm"
      ]
    },
    {
      "id": "candidate-datacite-project-male-birth-control-pashto",
      "title": "Male Birth Control [Pashto]",
      "url": "https://zenodo.org/doi/10.5281/zenodo.19390996",
      "category": "project",
      "source": "datacite",
      "status": "candidate",
      "summary": "Candidate record returned from DataCite DOI search for Pashto.",
      "primary_use": "Needs maintainer review before promotion to verified catalog.",
      "tasks": [],
      "pashto_evidence": {
        "evidence_text": "DataCite metadata includes Pashto markers in title or description.",
        "evidence_url": "https://zenodo.org/doi/10.5281/zenodo.19390996",
        "markers": [
          "pashto"
        ]
      },
      "tags": [
        "pashto",
        "candidate",
        "project",
        "datacite"
      ]
    },
    {
      "id": "candidate-zenodo-paper-openlogic-in-pashto-pakistan-proof-systems-and-completeness-work-in-progress",
      "title": "OpenLogic in Pashto — Pakistan: proof systems and completeness (work in progress)",
      "url": "https://zenodo.org/records/22646118",
      "category": "paper",
      "source": "zenodo",
      "status": "candidate",
      "summary": "A work-in-progress machine translation for Pakistani Pashto. This release adds the complete twelve-unit first-order completeness chapter to the reader: Henkin saturation, Lindenbaum extension, ordinary and factored term models, both complet",
      "primary_use": "Needs maintainer review before promotion to verified catalog.",
      "tasks": [],
      "pashto_evidence": {
        "evidence_text": "Zenodo metadata includes Pashto markers in title or description.",
        "evidence_url": "https://zenodo.org/records/22646118",
        "markers": [
          "pashto"
        ]
      },
      "tags": [
        "pashto",
        "candidate",
        "paper",
        "zenodo"
      ]
    },
    {
      "id": "candidate-datacite-project-openlogic-in-pashto-pakistan-proof-systems-and-completeness-work-in-progress",
      "title": "OpenLogic in Pashto — Pakistan: proof systems and completeness (work in progress)",
      "url": "https://zenodo.org/doi/10.5281/zenodo.22646118",
      "category": "project",
      "source": "datacite",
      "status": "candidate",
      "summary": "A work-in-progress machine translation for Pakistani Pashto. This release adds the complete twelve-unit first-order completeness chapter to the reader: Henkin saturation, Lindenbaum extension, ordinary and factored term models, both complet",
      "primary_use": "Needs maintainer review before promotion to verified catalog.",
      "tasks": [],
      "pashto_evidence": {
        "evidence_text": "DataCite metadata includes Pashto markers in title or description.",
        "evidence_url": "https://zenodo.org/doi/10.5281/zenodo.22646118",
        "markers": [
          "pashto"
        ]
      },
      "tags": [
        "pashto",
        "candidate",
        "project",
        "datacite"
      ]
    },
    {
      "id": "candidate-datacite-project-openlogic-in-pashto-pakistan-proof-systems-reference-repair-work-in-progress",
      "title": "OpenLogic in Pashto — Pakistan: proof-systems reference repair (work in progress)",
      "url": "https://zenodo.org/doi/10.5281/zenodo.22442605",
      "category": "project",
      "source": "datacite",
      "status": "candidate",
      "summary": "This bounded patch repairs the existing 108-page proof-systems reader. It replaces all 37 raw external-reference fallbacks on pages 41, 42, 44, 64, 65, 68, 91, 94 and 107 with eight human-readable Pashto result titles and adjacent blue `[OL",
      "primary_use": "Needs maintainer review before promotion to verified catalog.",
      "tasks": [],
      "pashto_evidence": {